id,Overview
321,"Robots-His father, her mother, his mother and her father all in one day."
230,Face/Off-You can shine no matter what you're made of.
322,"Bedtime Stories-In order to catch him, he must become him."
137,Road to Perdition-Whatever they dream up... he has to survive.
138,Just Go with It-Pray for Michael Sullivan.
139,Con Air-Sometimes a guy's best wingman... is a wingwoman
140,Eagle Eye-They were deadly on the ground; Now they have wings
326,Cold Mountain-Don't walk. Run.
274,The Book of Eli-Find the strength. Find the courage. No matter what it takes... find the way home.
327,Flubber-Some will kill to have it. He will kill to protect it.
67,The Haunting-Catch it if you can!
141,Space Jam-Some houses are born bad.
275,The Pink Panther-Get ready to jam.
424,The Day the Earth Stood Still-Pardon His French.
276,Conspiracy Theory-12.12.08 is the Day the Earth Stood Still
231,Fury-What if your most paranoid nightmares had just come true?
142,Six Days Seven Nights-War never ends quietly.
232,"Yogi Bear-After this week in paradise, they’re going to need a vacation."
143,Spirit: Stallion of the Cimarron-Life's a Pic-A-Nic
331,Zookeeper-Leader. Hero. Legend.
332,Lost in Space-Welcome to his jungle.
425,"The Manchurian Candidate-Danger, Will Robinson!"
333,Déjà Vu-This summer everything is under control.
144,Hotel Transylvania 2-Your future is set...
145,Fantasia 2000-They're back to raise a little terror
426,The Time Machine-
146,Mighty Joe Young-The greatest adventure THROUGH all time!
338,Swordfish-Survival is an instinct.
339,The Legend of Zorro-Log On. Hack In. Go Anywhere. Get Everything.
147,What Dreams May Come-The original caped crusader is back!
148,Little Nicky-After life there is more. The end is just the beginning.
233,The Brothers Grimm-He's Never Been To Earth. He's Never Even Slept Over Some Other Dude's House.
295,Mars Attacks!-Eliminating Evil Since 1812.
149,Evolution-Nice planet. We'll take it!
344,The Edge-
296,"Surrogates-They were fighting over a woman when the plane went down. Now, their only chance for survival is each other."
297,Thirteen Days-How do you save humanity when the only thing that's real is you?
345,Daylight-You'll never believe how close we came
298,Walking With Dinosaurs-No air. No escape. No time.
346,Battlefield Earth-The Greatest Adventure in 70 Million Years
347,Looney Tunes: Back in Action-Take Back The Planet
234,Nine-Real life has never been so animated.
235,"Timeline-This Holiday Season, Be Italian"
236,The Postman-They had to travel into the past to save the future
323,Babe: Pig in the City-The year is 2013. One man walked in off the horizon and hope came with him.
324,The Last Witch Hunter-This little pig went to the city...
150,Red Planet-Hunt forever.
355,Arthur and the Invisibles-Not A Sound. Not A Warning. Not A Chance. Not Alone.
153,Oceans-Adventure awaits in your own backyard.
367,A Sound of Thunder-Explore the depths of our planet's oceans.  Experience the stories that connect their world to ours.
154,Pompeii-Some Rules Should Never Be Broken.
325,Top Cat Begins-No warning. No escape.
395,A Beautiful Mind-
237,The Lion King-I need to believe that something extra ordinary is possible...
396,Journey 2: The Mysterious Island-Life's greatest adventure is finding your place in the Circle of Life.
397,Cloudy with a Chance of Meatballs 2-Believe the Impossible. Discover the Incredible.
151,Red Dragon-Something big was leftover.
152,Hidalgo-Before the Silence.
238,Jack and Jill-Unbridled. Unbroken. Unbeaten.
239,2 Fast 2 Furious-His twin sister is coming for the holidays... ...and it ain't pretty.
,The Little Prince-How Fast Do You Want It?
,The Invasion-Growing up isn't the problem... forgetting is.
,The Adventures of Rocky & Bullwinkle-Do not trust anyone. Do not show emotion. Do not fall asleep.
,The Secret Life of Pets-This summer it's not the same old bull.
,The League of Extraordinary Gentlemen-Think this is what they do all day?
,Despicable Me 2-The power of seven become a league of one.
,Independence Day-Back 2 Work
,The Lost World: Jurassic Park-Earth. Take a good look. It might be your last.
,Madagascar-Something has survived.
,Children of Men-Someone's got a zoo loose.
,X-Men-The future's a thing of the past.
,Wanted-Evolution Begins
,The Rock-Choose your destiny.
,Ice Age: The Meltdown-Alcatraz.  Only one man has ever broken out.  Now five million lives depend on two men breaking in.
,50 First Dates-The Ice age is melting away.
,Hairspray-Imagine having to win over the girl of your dreams... every friggin' day.
,"Exorcist: The Beginning-When you follow your own beat, the world will follow you."
,Inspector Gadget-Go back to where the horror began.
,Now You See Me-The greatest hero ever assembled.
,Grown Ups-4 amazing magicians. 3 impossible heists. 1 billion dollars. This is no illusion.
,The Terminal-Boys will be boys. . . some longer than others.
,Hotel for Dogs-Life is waiting.
,Vertical Limit-No stray gets turned away.
,Charlie Wilson's War-The Mountain Will Decide.
,Shark Tale-Based on a true story. You think we could make all this up?
,Dreamgirls-The story of what happens when one little fish tells a great white lie...
,Be Cool-One Dream Will Change Everything
,Munich-Everyone is looking for the next big hit
,Tears of the Sun-The world was watching in 1972 as 11 Israeli athletes were murdered at the Munich Olympics. This is the story of what happened next.
,Killers-He was trained to follow orders. He became a hero by defying them.
,The Man from U.N.C.L.E.-Perfect wife. Perfect target.
,Spanglish-Saving the world never goes out of style.
,Monster House-Every family has a hero.
,Bandits-The House is . . . ALIVE!
,"First Knight-Two's company, three's a crime."
,Anna and the King-Their greatest battle would be for her love.
,Immortals-
,Hostage-The Gods need a hero.
,Titan A.E.-Every Second Counts
,"Hollywood Homicide-When Earth Ends, The Adventure Begins."
,Soldier-
,"Carriers-Left for dead on a remote planet for obsolete machines and people, a fallen hero has one last battle to fight"
,"Monkeybone-The rules are simple. You break them, you die..."
,"Flight of the Phoenix-If It Yells, If It Swings, It's Got To Be Monkeybone!"
,"Unbreakable-Out of the ashes, hope will rise."
,Minions-Some things are only revealed by accident.
,"Sucker Punch-Before Gru, they had a history of bad bosses"
,Snake Eyes-You will be unprepared
,Sphere-Believe everything except your eyes.
,"The Angry Birds Movie-A thousand feet beneath the sea, the blackest holes are in the mind..."
,Fool's Gold-Why so angry?
,Funny People-This February True Love Takes a Dive.
,"The Kingdom-George Simmons was prepared to die, but then a funny thing happened."
,Talladega Nights: The Ballad of Ricky Bobby-How do you stop an enemy who isn't afraid to die?
,Dr. Dolittle 2-The story of a man who could only count to #1
,Braveheart-The doctor is in again.
,Jarhead-Every man dies. Not every man truly lives.
,The Simpsons Movie-Welcome to the suck.
,The Majestic-See our family. And feel better about yours.
,Driven-Sometimes your life comes into focus one frame at a time.
,Two Brothers-Get ready for the race of your life.
,"The Village-Two infant tiger cubs, separated from their parents and each other."
,Doctor Dolittle-There is no turning back
,Signs-He doesn't just talk to the animals!
,Shrek 2-It’s not like they didn’t warn us.
,Cars-Once upon another time...
,Runaway Bride-Ahhh... it's got that new movie smell.
,xXx-Catch her if you can.
,The SpongeBob Movie: Sponge Out of Water-A New Breed Of Secret Agent.
,Ransom-He's leaving his world behind.
,Inglourious Basterds-Someone is going to pay.
,Hook-Once upon a time in Nazi occupied France...
,Die Hard 2-What if Peter Pan grew up?
,S.W.A.T.-Die Harder
,Vanilla Sky-You're either S.W.A.T. or you're not.
,"Lady in the Water-Forget everything you know, and open your eyes."
,AVP: Alien vs. Predator-Time is running out for a happy ending.
,Alvin and the Chipmunks: The Squeakquel-Whoever wins... We lose
,We Were Soldiers-The Boys are back in town... and they have competition.
,Olympus Has Fallen-400 U.S paratroopers. 4000 Vietnamese soldiers. 12 000 miles away from home. 1 man led them into battle.
,Star Trek: Insurrection-When our flag falls our nation will rise.
,Battle: Los Angeles-The battle for paradise has begun.
,Big Fish-It's not war. It's survival.
,Wolf-An adventure as big as life itself.
,War Horse-The animal is out.
,The Monuments Men-Separated by War. Tested by Battle. Bound by Friendship.
,The Abyss-It was the greatest art heist in history
,"Wall Street: Money Never Sleeps-There's everything you've ever known about adventure, and then there's The Abyss."
,Dracula Untold-Gordon never gives up.
,The Siege-Every bloodline has a beginning
,Stardust-On November 6th our freedom is history
,Seven Years in Tibet-This Summer A Star Falls. The Chase Begins.
,The Dilemma-At the end of the world his real journey began.
,Bad Company-Two best friends. Nothing could come between them... or could it?
,Doom-Two Mismatched Partners. One Messed Up Case!
,I Spy-No one gets out alive.
,Underworld: Awakening-Attitude meets espionage.
,Rock of Ages-Vengeance Returns
,Hart's War-Nothin' but a good time
,"Killer Elite-Beyond Courage, Beyond Honor."
,Rollerball-May the best man live.
,Ballistic: Ecks vs. Sever-Go Ballistic
,Hard Rain-
,"Osmosis Jones-In the worst storm in living memory, one guard stands between five men and three million dollars."
,Legends of Oz: Dorothy's Return-Every BODY needs a hero
,Blackhat-There's trouble in OZ...
,Sky Captain and the World of Tomorrow-We are no longer in control.
,Basic Instinct 2-Who will save us?
,Escape Plan-Everything interesting begins in the mind
,The Legend of Hercules-No one breaks out alone.
,The Sum of All Fears-Every Man Has a Destiny
,"The Twilight Saga: Eclipse-27,000 nuclear weapons. One is missing."
,The Score-It all begins ... With a choice.
,Despicable Me-There are no partners in crime
,Money Train-Superbad. Superdad.
,"Ted 2-Get on, or GET OUT THE WAY!"
,"Agora-Ted is Coming, Again."
,"Mystery Men-Alexandria, Egypt. 391 A.D. The World Changed Forever."
,"Hall Pass-We're not your classic heroes, we're the other guys."
,"The Insider-One Week, No Rules"
,The Finest Hours-Two men driven to tell the truth... whatever the cost.
,"Body of Lies-32 survivors, room for 12."
,Dinner for Schmucks-Trust no one. Deceive everyone.
,Abraham Lincoln: Vampire Hunter-Takes One To Know One.
,Entrapment-Are you a patriot or a vampire?
,The X Files-The trap is set.
,The Last Legion-Fight the Future
,Saving Private Ryan-The end of an empire...the beginning of a legend.
,Need for Speed-The mission is a man.
,What Women Want-For honor. For love. For redemption.
,Ice Age-He has the power to hear everything women are thinking. Finally... a man is listening.
,Dreamcatcher-They came. They thawed. They conquered.
,Lincoln-A circle of friendship. A web of mystery. A pattern of fear.
,"The Matrix-With the moral courage and fierce determination to succeed, his choices will change the fate of generations to come."
,Apollo 13-Welcome to the Real World.
,"The Santa Clause 2-Houston, we have a problem."
,Les Misérables-What's Christmas Fun without some Reindeer Games?
,You've Got Mail-Fight. Dream. Hope. Love.
,Step Brothers-Someone you pass on the street may already be the love of your life.
,The Mask of Zorro-They grow up so fast.
,Due Date-No one has seen his face... but everyone ... knows this mark.
,Unbroken-Leave Your Comfort Zone
,Space Cowboys-Survival. Resilience. Redemption.
